{
  "$schema": "http://json-schema.org/draft-07/schema#",
  "title": "Ã˜yna Knowledge Graph Schema",
  "type": "object",
  "required": ["graph_version", "nodes", "edges"],
  "properties": {
    "graph_version": { "type": "string" },
    "based_on_model": { "type": "string" },
    "description": { "type": "string" },

    "node_types": {
      "type": "array",
      "items": { "type": "string" }
    },

    "nodes": {
      "type": "array",
      "items": {
        "type": "object",
        "required": ["id", "type", "label"],
        "properties": {
          "id": { "type": "string" },
          "type": { "type": "string" },
          "label": { "type": "string" }
        },
        "additionalProperties": true
      }
    },

    "edge_types": {
      "type": "array",
      "items": { "type": "string" }
    },

    "edges": {
      "type": "array",
      "items": {
        "type": "object",
        "required": ["from", "to", "type"],
        "properties": {
          "from": { "type": "string" },
          "to": { "type": "string" },
          "type": { "type": "string" }
        },
        "additionalProperties": true
      }
    }
  },
  "additionalProperties": true
}
